{
  "eventId": "6f1c2a3b-4d5e-4f60-8a71-b2c3d4e5f601",
  "eventType": "LedgerPosted",
  "version": 1,
  "occurredAt": "2026-10-16T08:30:00.123456Z",
  "tenantId": "00000000-0000-0000-0000-000000000001",
  "traceId": "4bf92f3577b34da6a3ce929d0e0e4736",
  "payload": {
    "transactionId": "0b9d8e7f-6a5b-4c3d-9e2f-1a0b9c8d7e6f",
    "entryId": "6f1c2a3b-4d5e-4f60-8a71-b2c3d4e5f601",
    "type": "TRANSFER",
    "currency": "VND",
    "legs": [
      { "accountRef": "a1a1a1a1-b2b2-4c3c-8d4d-e5e5e5e5e5e5", "amountMinor": -250000 },
      { "accountRef": "f6f6f6f6-0707-4818-9929-3a3a3a3a3a3a", "amountMinor": 250000 }
    ]
  }
}
